{
  "graph_id": "ulga_graph.empty",
  "contract_version": "ULGA-S2",
  "schema_version": "1.0.0",
  "formal_data_mounted": false,
  "nodes": [],
  "edges": [],
  "metadata": {
    "purpose": "ULGA-S2 empty graph scaffold for schema validation only.",
    "data_policy": "empty_scaffold_only",
    "forbidden_mounts": [
      "grammar_profile",
      "vocabulary",
      "chunk_profile",
      "learner_state"
    ]
  },
  "validation_status": "untested"
}
